how much is an over ##dra ##ft fee for bank	change_accent
why are expo ##nent ##s pre ##formed before multiplication in the order of operations	change_accent
what size wipe ##rs does this car take	change_accent
where is the dip ##stick	change_accent
how much is 1 share of aa ##pl	change_accent
how is glue made	change_accent
any headlines from my area	change_accent
what is the largest state in the us	change_accent
what is the current market trend	change_accent
what is the most popular airline	change_accent
what is the formula for the ci ##rc ##um ##ference of a circle	change_accent
what are some ways to reduce spending	change_accent
what time does the louvre open	change_accent
are there any local stations covering the moral march in raleigh in february ##u	change_accent
how many planets have we discovered	change_accent
how do i change my billing address	change_accent
how do i open an online line of credit	change_accent
how do i remove a coffee b ##lem ##ish	change_accent
how expensive is an apple share	change_accent
where can i find the cruise control on my kia sport ##age 2010	change_accent
how many sides are in a he ##xa ##gon	change_accent
how fast does an airplane travel	change_accent
is it worth investing in target	change_accent
i need to speak to customer service regarding my flight	change_accent
how long do wire transfers take	change_accent
what are some deals on amazon	change_accent
what city is the super bowl	change_accent
what trees change color in autumn	change_accent
do people prefer summer over fall	change_accent
how long is winter	change_accent
what were some of ben franklin ' s notable accomplishments	change_accent
where was john denver born	change_accent
where did abraham lincoln live	change_accent
when was kobe bryant born	change_accent
who ' s toledo ' s starting point guard for the next game	change_accent
how many players are on the chicago bulls	change_accent
who is the coach of the chicago bulls	change_accent
when do the utah jazz play next	change_accent
what other nations were involved in the chinese trade war	change_accent
what years has korea been at war	change_accent
when was the theory of evolution first considered	change_accent
who formulated the theory of relativity	change_accent
what stage of evolution am i	change_accent
what other personality type is most compatible with in ##f ##js	change_accent
what does my personality mean	change_accent
what ' s the most dominant scale in bluegrass	change_accent
what year was sax ##ap ##hone first played	change_accent
which piano is best for classical	change_accent
is k - 12 education required outside of the united states	change_accent
what are the benefits of completing college	change_accent
are you able to answer algebra equations	change_accent
can you help me study for a history exam	change_accent
how many points per game is le ##bron james averaging this season	change_accent
what team does eli mann ##ign play for	change_accent
get me dwight howard shooting average	change_accent
can you list me tiger wood ' s stats	change_accent
what ' s the run ##time of all the lord of the rings movies combined	change_accent
which character is the most famous from titanic	change_accent
how many oscar ##s did star wars films win	change_accent
what year was shaw ##shan ##k redemption released	change_accent
which marvel character has appeared in the most movies	change_accent
when ' s the next movie starring thor set to come out	change_accent
who was the first capcom character	change_accent
are any justice league movies coming out	change_accent
can you tell me something about the nfl	change_accent
please explain the catch rule to me	change_accent
is there overtime in college football	change_accent
when did the mls start	change_accent
what ' s the best price on super smash bros ultimate right now	change_accent
what is the highest earning game on atari	change_accent
when is the next nintendo direct	change_accent
when was nintendo created	change_accent
please find the capital of pakistan and its population	change_accent
how many people live in taiwan	change_accent
what are some of picasso ' s most famous works	change_accent
what are van gogh ' s best pieces	change_accent
where can i see art	change_accent
when did cam ##us die	change_accent
how much money does radio ##head earn a year	change_accent
who is radio ##head	change_accent
what ' s the biggest sa ##as marketing company in the united states	change_accent
how do i start my own marketing firm	change_accent
how can i get involved in restaurant marketing	change_accent
what is sa ##as marketing	change_accent
what do you call someone who was born in se ##go ##via	change_accent
what is rhineland	change_accent
who is the scar ##iest character in start trek	change_accent
who is the current captain of this ship	change_accent
what year was star trek released	change_accent
when was toyota created	change_accent
who are some notable alumni of uc ##sd	change_accent
what is the next football game	change_accent
how many students attend uc ##sb	change_accent
when do classes start	change_accent
how can i become an aerospace engineer	change_accent
what percentage of species display cold blooded traits	change_accent
what does it mean to be an alpha male	change_accent
what animals have alpha males	change_accent
why do males want to be alpha	change_accent
what ' s the average battery life of an android phone	change_accent
